    1  2026-06-11 05:10:00.000001 IP 192.168.12.2 > 192.168.12.1: SMT [|smt]
    2  2026-06-11 05:10:01.000002 IP 192.168.12.2 > 192.168.12.1: SMT 32768 > 2000, DATA, id 100 [|smt]
    3  2026-06-11 05:10:02.000003 IP 192.168.12.1 > 192.168.12.2: SMT 2000 > 32768, GRANT, id 101 [|smt]
    4  2026-06-11 05:10:03.000004 IP 192.168.12.1 > 192.168.12.2: SMT 2000 > 32769, RESEND, id 102 [|smt]
    5  2026-06-11 05:10:04.000005 IP 192.168.12.1 > 192.168.12.2: SMT 2000 > 32770, CUTOFFS, id 103 [|smt]
    6  2026-06-11 05:10:05.000006 IP 192.168.12.2 > 192.168.12.1: SMT 32771 > 2000, ACK, id 104 [|smt]
    7  2026-06-11 05:10:06.000007 IP 192.168.12.2 > 192.168.12.1: SMT 32768 > 2000, DATA, id 105, offset 8, msglen 16 [|smt]
