    1  2026-06-11 05:20:00.000001 IP 192.168.12.2 > 192.168.12.1: SMT [length 27 < 28] (invalid)
    2  2026-06-11 05:20:01.000002 IP 192.168.12.2 > 192.168.12.1: SMT 32768 > 2000, DATA, id 201 [length 51 < 52] (invalid)
    3  2026-06-11 05:20:02.000003 IP 192.168.12.1 > 192.168.12.2: SMT 2000 > 32768, GRANT, id 202 [length 32 < 33] (invalid)
    4  2026-06-11 05:20:03.000004 IP 192.168.12.1 > 192.168.12.2: SMT 2000 > 32769, RESEND, id 203 [length 36 < 37] (invalid)
    5  2026-06-11 05:20:04.000005 IP 192.168.12.1 > 192.168.12.2: SMT 2000 > 32770, CUTOFFS, id 204 [length 61 < 62] (invalid)
    6  2026-06-11 05:20:05.000006 IP 192.168.12.2 > 192.168.12.1: SMT 32771 > 2000, ACK, id 205 [length 79 < 80] (invalid)
    7  2026-06-11 05:20:06.000007 IP 192.168.12.2 > 192.168.12.1: SMT 32771 > 2000, ACK, id 206, 6 acks, invalid count
    8  2026-06-11 05:20:07.000008 IP 192.168.12.1 > 192.168.12.2: SMT 2000 > 32772, type 0x99, id 207
