    1  2026-06-11 04:23:51.858593 IP 192.168.12.2 > 192.168.12.1: SMT 32768 > 2000, DATA, id 2, offset 0, msglen 64, TLS 1.2 record len 92, record seq 18446744073709551615
    2  2026-06-11 04:23:51.858616 IP 192.168.12.1 > 192.168.12.2: SMT 2000 > 32768, CUTOFFS, id 3, version 2
    3  2026-06-11 04:23:59.063379 IP 192.168.12.1 > 192.168.12.2: SMT 2000 > 32770, GRANT, id 43, offset 100000, priority 0
    4  2026-06-11 04:24:03.271628 IP 192.168.12.1 > 192.168.12.2: SMT 2000 > 32771, RESEND, id 63, offset 5580, length 2790, priority 7
    5  2026-06-11 04:24:03.272040 IP 192.168.12.1 > 192.168.12.2: SMT 2000 > 32771, BUSY, id 63
    6  2026-06-11 04:24:08.328965 IP 192.168.12.1 > 192.168.12.2: SMT 2000 > 32772, UNKNOWN, id 93
    7  2026-06-11 04:23:51.861303 IP 192.168.12.1 > 192.168.12.2: SMT 2000 > 32768, NEED_ACK, id 21
    8  2026-06-11 04:24:03.403016 IP 192.168.12.2 > 192.168.12.1: SMT 32771 > 2000, ACK, id 68, 2 acks
    9  2026-06-11 04:24:03.271690 IP 192.168.12.2 > 192.168.12.1: SMT 32771 > 2000, DATA, id 62, offset 5580, msglen 100000, TLS 1.2 record len 1423, record seq 18446744073709551615
   10  2026-06-11 04:24:08.328965 IP 192.168.12.1 > 192.168.12.2: SMT 2000 > 32772, FREEZE, id 93
   11  2026-06-11 04:43:01.698274 IP 192.168.12.2 > 192.168.12.1: SMT 32768 > 2000, DATA, id 2, offset 0, msglen 20000, TLS 1.2 record len 8563, record seq 0
   12  2026-06-11 04:43:01.698410 IP 192.168.12.1 > 192.168.12.2: SMT 2000 > 32768, DATA, id 3, offset 0, msglen 20000, TLS 1.2 record len 8563, record seq 0, partial 1423/8563
   13  2026-06-11 04:43:01.698410 IP 192.168.12.1 > 192.168.12.2: SMT 2000 > 32768, DATA, id 3, offset 0, msglen 20000, record continuation 1428 bytes
